Date,Resource,Project,Task,Hour(s) Spent
"Dec 31, 2018","Yosef Martinez","CC.1173.FACT.OFFICEMAX.IMPLANT.09JULIO2018","Se trabaja en el requerimiento del sistema de importaciones","4"
"Dec 31, 2018","Ricardo Gama Garcia","CC.1173.FACT.OFFICEMAX.IMPLANT.09JULIO2018","Procesamiento de Formatos","9"
"Jan 02, 2019","Yosef Martinez","CC.1173.FACT.OFFICEMAX.IMPLANT.09JULIO2018","Correccion de errores portal de rh","8"
"Jan 02, 2019","Ricardo Gama Garcia","CC.1173.FACT.OFFICEMAX.IMPLANT.09JULIO2018","Procesar entradas y salidas WHSED","8.5"
"Jan 03, 2019","Yosef Martinez","CC.1173.FACT.OFFICEMAX.IMPLANT.09JULIO2018","Se trabaja en el requerimiento del sistema de importaciones","8"
"Jan 03, 2019","Ricardo Gama Garcia","CC.1173.FACT.OFFICEMAX.IMPLANT.09JULIO2018","Análisis de 635 movimientos de inventario no reconocidos en tienda por el usuario PORTPV_PRO","8.5"
"Jan 04, 2019","Yosef Martinez","CC.1173.FACT.OFFICEMAX.IMPLANT.09JULIO2018","Se trabaja en el requerimiento del sistema de importaciones","8"
"Jan 04, 2019","Ricardo Gama Garcia","CC.1173.FACT.OFFICEMAX.IMPLANT.09JULIO2018","Generación de reporte con carttons","6.5"
